{
  "artifact_id": "db5ceb67-2867-4a2e-8cfa-0101e8ee08e8",
  "boundary": "Real claim-verification dataset, TF-IDF+logreg cheap predictor, bootstrap-ensemble expensive verification, deterministic, no LLM. Admissibility/engineering signal \u2014 not a science claim about dopamine.",
  "claim": "vRPE-gated routing beats uncertainty_only (no_vRPE) on Verified Closure Rate under equal budget, advantage gone under inverted vRPE.",
  "config_hash": "dca8ca1a6c418ac555f65a4aee5f72ff564601871d699c689192779f29fe95c6",
  "created_at": "2026-05-16T11:54:42.526619+00:00",
  "dataset_hash": "0e981c269d4099a9e3a4ff97fd3b54df216b85846efd5d7a980d8969e3049ee0",
  "dataset_name": "SciFact (allenai) binary SUPPORT/CONTRADICT",
  "dataset_source_tag": "scifact_full",
  "delta_dopa_vs_inverted": 0.012234042553191493,
  "delta_dopa_vs_uncertainty": -0.006914893617021245,
  "equal_budget_extra_calls": 651.2,
  "kill_reason": "Pre-registered survival predicate not met under equal budget.",
  "per_seed": {
    "101": {
      "cheap_only": 0.4946808510638298,
      "dopa_extra_budget": 620.0,
      "dopa_vrpe": 0.5212765957446809,
      "dopa_vrpe_inverted": 0.5106382978723404,
      "fixed_full": 0.5372340425531915,
      "n_items": 188.0,
      "random_gate": 0.5106382978723404,
      "uncertainty_only": 0.5319148936170213
    },
    "11": {
      "cheap_only": 0.4946808510638298,
      "dopa_extra_budget": 668.0,
      "dopa_vrpe": 0.5159574468085106,
      "dopa_vrpe_inverted": 0.5,
      "fixed_full": 0.5212765957446809,
      "n_items": 188.0,
      "random_gate": 0.5053191489361702,
      "uncertainty_only": 0.5159574468085106
    },
    "202": {
      "cheap_only": 0.4946808510638298,
      "dopa_extra_budget": 660.0,
      "dopa_vrpe": 0.5053191489361702,
      "dopa_vrpe_inverted": 0.5,
      "fixed_full": 0.5106382978723404,
      "n_items": 188.0,
      "random_gate": 0.4946808510638298,
      "uncertainty_only": 0.5106382978723404
    },
    "23": {
      "cheap_only": 0.4946808510638298,
      "dopa_extra_budget": 644.0,
      "dopa_vrpe": 0.5106382978723404,
      "dopa_vrpe_inverted": 0.5159574468085106,
      "fixed_full": 0.5319148936170213,
      "n_items": 188.0,
      "random_gate": 0.5053191489361702,
      "uncertainty_only": 0.526595744680851
    },
    "303": {
      "cheap_only": 0.4946808510638298,
      "dopa_extra_budget": 684.0,
      "dopa_vrpe": 0.5372340425531915,
      "dopa_vrpe_inverted": 0.4946808510638298,
      "fixed_full": 0.5372340425531915,
      "n_items": 188.0,
      "random_gate": 0.526595744680851,
      "uncertainty_only": 0.5372340425531915
    },
    "404": {
      "cheap_only": 0.4946808510638298,
      "dopa_extra_budget": 684.0,
      "dopa_vrpe": 0.48404255319148937,
      "dopa_vrpe_inverted": 0.5,
      "fixed_full": 0.48936170212765956,
      "n_items": 188.0,
      "random_gate": 0.5,
      "uncertainty_only": 0.48936170212765956
    },
    "42": {
      "cheap_only": 0.4946808510638298,
      "dopa_extra_budget": 644.0,
      "dopa_vrpe": 0.5159574468085106,
      "dopa_vrpe_inverted": 0.5053191489361702,
      "fixed_full": 0.526595744680851,
      "n_items": 188.0,
      "random_gate": 0.5053191489361702,
      "uncertainty_only": 0.5212765957446809
    },
    "505": {
      "cheap_only": 0.4946808510638298,
      "dopa_extra_budget": 660.0,
      "dopa_vrpe": 0.5212765957446809,
      "dopa_vrpe_inverted": 0.5053191489361702,
      "fixed_full": 0.5319148936170213,
      "n_items": 188.0,
      "random_gate": 0.5106382978723404,
      "uncertainty_only": 0.5319148936170213
    },
    "606": {
      "cheap_only": 0.4946808510638298,
      "dopa_extra_budget": 620.0,
      "dopa_vrpe": 0.526595744680851,
      "dopa_vrpe_inverted": 0.5106382978723404,
      "fixed_full": 0.5425531914893617,
      "n_items": 188.0,
      "random_gate": 0.48936170212765956,
      "uncertainty_only": 0.5425531914893617
    },
    "707": {
      "cheap_only": 0.4946808510638298,
      "dopa_extra_budget": 628.0,
      "dopa_vrpe": 0.5212765957446809,
      "dopa_vrpe_inverted": 0.4946808510638298,
      "fixed_full": 0.5212765957446809,
      "n_items": 188.0,
      "random_gate": 0.5106382978723404,
      "uncertainty_only": 0.5212765957446809
    }
  },
  "policy_scores": {
    "cheap_only": 0.4946808510638298,
    "dopa_vrpe": 0.5159574468085106,
    "dopa_vrpe_inverted": 0.5037234042553191,
    "fixed_full": 0.525,
    "random_gate": 0.5058510638297873,
    "uncertainty_only": 0.5228723404255319
  },
  "policy_std": {
    "cheap_only": 0.0,
    "dopa_vrpe": 0.013456500681567573,
    "dopa_vrpe_inverted": 0.00674924337257952,
    "fixed_full": 0.014865094268598004,
    "random_gate": 0.00964806231234948,
    "uncertainty_only": 0.014479422966825745
  },
  "preregistration": "docs/experiments/DOPA_CLOSURE_DEATH_TEST_CONTRACT.md",
  "reproducibility_hash": "61a06bc873bf4a990e59053c57b885f0995d10510fe454bd573950ee53d53578",
  "sample_count": 188,
  "schema": "dopa_death_test_result/1",
  "seed_sweep": [
    11,
    23,
    42,
    101,
    202,
    303,
    404,
    505,
    606,
    707
  ],
  "sign_fraction": 0,
  "survival_predicate": {
    "1_delta_vs_uncertainty>=DELTA_MIN": false,
    "2_sign_consistency>=SIGN_FRAC": false,
    "3_dopa>random": true,
    "4_inverted<=dopa-EPS": true
  },
  "train_count": 505,
  "verdict": "KILLED"
}